{
  "$schema": "https://json-schema.org/draft/2020-12/schema",
  "title": "OpenPhenology manifest/1",
  "description": "Every file in a release, with its SHA-256, size and format.",
  "type": "object",
  "required": [
    "id",
    "kind",
    "format",
    "provenance",
    "data"
  ],
  "properties": {
    "id": {
      "type": "string",
      "pattern": "^releases/\\d{4}-\\d{2}-\\d{2}/manifest(/\\d+)?\\.json$"
    },
    "kind": {
      "const": "manifest"
    },
    "format": {
      "type": "string",
      "pattern": "^manifest/1\\.\\d+$"
    },
    "provenance": {
      "type": "object",
      "required": [
        "release",
        "sources",
        "licences",
        "gbif_download_dois",
        "method",
        "taxonomy",
        "boundaries",
        "ranges",
        "protection",
        "code",
        "run"
      ],
      "properties": {
        "release": {
          "type": "string",
          "pattern": "^\\d{4}-\\d{2}-\\d{2}$"
        },
        "sources": {
          "type": "array",
          "items": {
            "type": "string"
          }
        },
        "licences": {
          "type": "array",
          "items": {
            "type": "string"
          }
        },
        "gbif_download_dois": {
          "type": "array",
          "items": {
            "type": "string"
          }
        },
        "method": {
          "anyOf": [
            {
              "type": "string"
            },
            {
              "type": "null"
            }
          ]
        },
        "taxonomy": {
          "anyOf": [
            {
              "type": "string"
            },
            {
              "type": "null"
            }
          ]
        },
        "boundaries": {
          "anyOf": [
            {
              "type": "string"
            },
            {
              "type": "null"
            }
          ]
        },
        "ranges": {
          "anyOf": [
            {
              "type": "array",
              "items": {
                "type": "string"
              }
            },
            {
              "type": "null"
            }
          ]
        },
        "protection": {
          "anyOf": [
            {
              "type": "object",
              "additionalProperties": {
                "type": "string"
              }
            },
            {
              "type": "null"
            }
          ]
        },
        "code": {
          "anyOf": [
            {
              "type": "string"
            },
            {
              "type": "null"
            }
          ]
        },
        "run": {
          "anyOf": [
            {
              "type": "string"
            },
            {
              "type": "null"
            }
          ]
        }
      }
    },
    "data": {
      "type": "object",
      "required": [
        "release",
        "published_at",
        "files",
        "counts"
      ],
      "properties": {
        "release": {
          "type": "string",
          "pattern": "^\\d{4}-\\d{2}-\\d{2}$"
        },
        "published_at": {
          "type": "string",
          "pattern": "^\\d{4}-\\d{2}-\\d{2}T\\d{2}:\\d{2}:\\d{2}Z$"
        },
        "files": {
          "type": "array",
          "items": {
            "type": "object",
            "required": [
              "path",
              "format",
              "sha256",
              "bytes"
            ],
            "properties": {
              "path": {
                "type": "string",
                "minLength": 1
              },
              "format": {
                "type": "string",
                "pattern": "^[a-z]+(-[a-z]+)*/\\d+\\.\\d+$"
              },
              "sha256": {
                "type": "string",
                "pattern": "^[0-9a-f]{64}$"
              },
              "bytes": {
                "type": "integer",
                "minimum": 0
              }
            }
          }
        },
        "counts": {
          "type": "object",
          "required": [
            "species",
            "state_results",
            "county_results",
            "records"
          ],
          "properties": {
            "species": {
              "type": "integer",
              "minimum": 0
            },
            "state_results": {
              "type": "integer",
              "minimum": 0
            },
            "county_results": {
              "type": "integer",
              "minimum": 0
            },
            "records": {
              "type": "integer",
              "minimum": 0
            }
          }
        }
      }
    }
  }
}
